{
  "$schema": "https://json-schema.org/draft/2020-12/schema",
  "$id": "https://standard.rand0m.ai/aieds/v2/aieds.schema.json",
  "title": "AiEDs Disclosure Record",
  "description": "AI Energy Disclosure Standard 2.0.0 - a single disclosure record for an AI subject's modeled energy consumption and carbon footprint. AiEDs scope is device, usage, inference, or training. It is a per-subject disclosure and is NOT a planetary or Earth-system health score, which is a different kind of claim with different inputs.",
  "type": "object",
  "required": [
    "id",
    "subject",
    "scope",
    "window",
    "energyKWh",
    "gCO2e",
    "gridIntensity",
    "confidence",
    "methodologyVersion",
    "source",
    "generatedAt"
  ],
  "additionalProperties": false,
  "properties": {
    "$schema": {
      "type": "string",
      "description": "Optional JSON Schema URI - may be included for editor tooling."
    },
    "id": {
      "type": "string",
      "description": "Stable unique identifier for this disclosure record. UUID or URI recommended (e.g. 'aieds:my-model:inference:2026-06-29:001')."
    },
    "subject": {
      "type": "object",
      "description": "The AI subject this disclosure covers.",
      "required": [
        "kind",
        "name"
      ],
      "additionalProperties": false,
      "properties": {
        "kind": {
          "type": "string",
          "enum": [
            "model",
            "agent",
            "app"
          ],
          "description": "model = a foundation/fine-tuned model; agent = an orchestrated AI agent; app = an AI-powered application."
        },
        "name": {
          "type": "string",
          "description": "Human-readable name of the subject."
        },
        "version": {
          "type": "string",
          "description": "Optional semver or other version string."
        }
      }
    },
    "scope": {
      "type": "string",
      "enum": [
        "device",
        "usage",
        "inference",
        "training"
      ],
      "description": "Measurement boundary. 'device' = client device energy (CPU/GPU/display) running an AI app; 'usage' = device + server-side inference combined; 'inference' = server-side inference only; 'training' = model training run. AiEDs v1 is optimized for device/usage/inference (agent-native). Training disclosures are supported but factor tables are inference-focused."
    },
    "window": {
      "type": "string",
      "pattern": "^P(?:\\d+Y)?(?:\\d+M)?(?:\\d+W)?(?:\\d+D)?(?:T(?:\\d+H)?(?:\\d+M)?(?:\\d+S)?)?$",
      "description": "ISO 8601 duration this disclosure covers (e.g. 'P30D' = 30 days, 'PT15M' = 15 minutes, 'PT1H' = 1 hour)."
    },
    "compute": {
      "type": "object",
      "description": "Optional compute metrics used to derive energyKWh. Provide at least one of tokens, gpuSeconds, or flops for provenance; omit if energy was measured directly.",
      "additionalProperties": false,
      "properties": {
        "tokens": {
          "type": "number",
          "minimum": 0,
          "description": "Total tokens processed (input + output)."
        },
        "gpuSeconds": {
          "type": "number",
          "minimum": 0,
          "description": "Wall-clock GPU-seconds consumed across all accelerators."
        },
        "flops": {
          "type": "number",
          "minimum": 0,
          "description": "Total floating-point operations (FP16/BF16 equivalent)."
        },
        "hardware": {
          "type": "string",
          "description": "Accelerator identifier (e.g. 'NVIDIA H100 SXM', 'Google TPU v4'). Used with gpuSeconds to derive energy."
        }
      }
    },
    "energyKWh": {
      "type": "number",
      "minimum": 0,
      "description": "Total energy consumed in kilowatt-hours for the declared scope and window."
    },
    "gCO2e": {
      "type": "number",
      "minimum": 0,
      "description": "Total greenhouse gas emissions in grams of CO2-equivalent. Must be derived as energyKWh x gridIntensity.gCO2ePerKWh (within rounding tolerance)."
    },
    "gridIntensity": {
      "type": "object",
      "description": "Grid carbon intensity applied to convert energy to CO2e.",
      "required": [
        "gCO2ePerKWh"
      ],
      "additionalProperties": false,
      "properties": {
        "gCO2ePerKWh": {
          "type": "number",
          "minimum": 0,
          "description": "Carbon intensity in grams of CO2-equivalent per kilowatt-hour."
        },
        "region": {
          "type": "string",
          "description": "Grid region or country code used (e.g. 'US', 'EU27', 'France', 'global_average')."
        }
      }
    },
    "confidence": {
      "description": "Confidence in the energyKWh figure. String enum or fractional 0 to 1. 'high' = direct hardware power measurement; 'med' = GPU-seconds x TDP factor; 'low' = token or FLOP proxy.",
      "oneOf": [
        {
          "type": "string",
          "enum": [
            "low",
            "med",
            "high"
          ]
        },
        {
          "type": "number",
          "minimum": 0,
          "maximum": 1
        }
      ]
    },
    "provenance": {
      "type": "string",
      "enum": [
        "measured",
        "vendor-published",
        "class-estimated",
        "unknown"
      ],
      "description": "Optional. Where the emission or energy factor came from, on the section 5.1 ladder: measured, vendor-published, class-estimated, or unknown. This is a DIFFERENT ladder from `confidence`, which grades how the energy figure itself was arrived at. A record may carry both; neither implies the other. Never upgrade either because an estimate looks plausible."
    },
    "water": {
      "type": "object",
      "description": "Optional. Modeled water consumed (methodology 2.6, added in 2.5.0), inference only. A record without this block makes no water claim. A value that cannot be sourced is null, never zero. Water is a modeled estimate: confidence is 'low' by rule and the range is always present when waterL is.",
      "required": [
        "waterL",
        "siteL",
        "gridL",
        "rangeL",
        "basis",
        "siteWueLPerKWh",
        "gridWaterLPerKWh",
        "gridBasis",
        "confidence",
        "comparison",
        "factorsVersion"
      ],
      "additionalProperties": false,
      "properties": {
        "waterL": {
          "type": ["number", "null"],
          "minimum": 0,
          "description": "Liters consumed: siteL + gridL (rule W2, within rounding). Null when either term is unsourced."
        },
        "siteL": {
          "type": ["number", "null"],
          "minimum": 0,
          "description": "Liters consumed on site for cooling: energyKWh x siteWueLPerKWh. Kept apart from gridL."
        },
        "gridL": {
          "type": ["number", "null"],
          "minimum": 0,
          "description": "Liters consumed to make the grid electricity: energyKWh x gridWaterLPerKWh. Kept apart from siteL."
        },
        "rangeL": {
          "description": "Low and high liters from the Table 5 range ends. Null only when waterL is null (rule W4).",
          "oneOf": [
            { "type": "null" },
            {
              "type": "object",
              "required": ["low", "high"],
              "additionalProperties": false,
              "properties": {
                "low": { "type": "number", "minimum": 0 },
                "high": { "type": "number", "minimum": 0 }
              }
            }
          ]
        },
        "basis": {
          "const": "consumption",
          "description": "Consumption (water that leaves the local source), never withdrawal (rule W5)."
        },
        "siteWueLPerKWh": {
          "type": ["number", "null"],
          "minimum": 0,
          "description": "Site water coefficient applied, liters per kWh."
        },
        "gridWaterLPerKWh": {
          "type": ["number", "null"],
          "minimum": 0,
          "description": "Grid water coefficient applied, liters per kWh."
        },
        "gridBasis": {
          "type": "string",
          "enum": ["default", "region"],
          "description": "'default' is the US average and must be labeled 'US average' when shown (rule W10). 'region' requires gridRegion."
        },
        "gridRegion": {
          "type": "string",
          "description": "The region whose grid figure was used. Present only when gridBasis is 'region' (rule W8)."
        },
        "confidence": {
          "type": "string",
          "enum": ["low", "med"],
          "description": "Confidence in the water figure. 'low' by rule; 'med' only with metered site water and a regional grid figure (rule W3). 'high' is not defined for water."
        },
        "comparison": {
          "description": "Level 3 educational comparison in teaspoons (5 mL). Null when waterL is null.",
          "oneOf": [
            { "type": "null" },
            {
              "type": "object",
              "required": ["unit", "value"],
              "additionalProperties": false,
              "properties": {
                "unit": { "const": "teaspoon" },
                "value": { "type": "number", "minimum": 0 }
              }
            }
          ]
        },
        "factorsVersion": {
          "type": "string",
          "pattern": "^2[.][0-9]+[.][0-9]+$",
          "description": "Methodology version whose Table 5 supplied the coefficients."
        }
      },
      "allOf": [
        {
          "if": { "properties": { "gridBasis": { "const": "region" } }, "required": ["gridBasis"] },
          "then": { "required": ["gridRegion"] },
          "else": { "not": { "required": ["gridRegion"] } }
        },
        {
          "if": { "properties": { "waterL": { "type": "null" } }, "required": ["waterL"] },
          "then": {
            "properties": { "rangeL": { "type": "null" }, "comparison": { "type": "null" } }
          },
          "else": {
            "properties": {
              "siteL": { "type": "number" },
              "gridL": { "type": "number" },
              "rangeL": { "type": "object" },
              "comparison": { "type": "object" }
            }
          }
        }
      ]
    },
    "methodologyVersion": {
      "type": "string",
      "pattern": "^2[.][0-9]+[.][0-9]+$",
      "description": "AiEDs methodology version, semver. Must be a 2.x version: the standard states that 1.x is superseded and must not be used for new disclosures, so a 1.x record is not conformant under this schema."
    },
    "source": {
      "type": "string",
      "description": "URI or name of the tool or process that generated this disclosure (e.g. 'aieds-mcp v1.0.0', 'my-energy-meter v2')."
    },
    "generatedAt": {
      "type": "string",
      "format": "date-time",
      "description": "ISO 8601 datetime when this disclosure was generated."
    }
  }
}
