{
  "id": "aieds:rand0m-ai-v2:inference:2026-06-29:001",
  "subject": {
    "kind": "model",
    "name": "rand0m-ai-v2",
    "version": "2.0.1"
  },
  "scope": "inference",
  "window": "PT6M",
  "compute": {
    "gpuSeconds": 360,
    "hardware": "NVIDIA H100 SXM"
  },
  "energyKWh": 0.07,
  "gCO2e": 30.5,
  "gridIntensity": {
    "gCO2ePerKWh": 436,
    "region": "global_average"
  },
  "confidence": "med",
  "methodologyVersion": "1.0.0",
  "source": "aieds-mcp v1.0.0",
  "generatedAt": "2026-06-29T06:10:00Z"
}
